{
  "attribution_records": [
    {
      "attribution_text": "geoBoundaries data requires CC BY 4.0 attribution.",
      "downstream_outputs": [
        "atlas/README.md",
        "atlas/atlas_manifest.json",
        "atlas/attribution.json",
        "atlas/geojson/provinces.geojson",
        "atlas/scenarios/modern-baseline/countries.json",
        "atlas/scenarios/modern-baseline/legend.json",
        "atlas/scenarios/modern-baseline/owners.geojson",
        "atlas/scenarios/modern-baseline/ownership.csv",
        "atlas/scenarios/modern-baseline/ownership.json",
        "atlas/scenarios/modern-baseline/ownership_choropleth.geojson",
        "atlas/scenarios/modern-baseline/scenario_manifest.json",
        "atlas/scenarios/modern-baseline/tags.csv",
        "atlas/scenarios/modern-baseline/uncertainty.geojson",
        "atlas/scenarios/official-1444/countries.json",
        "atlas/scenarios/official-1444/legend.json",
        "atlas/scenarios/official-1444/owners.geojson",
        "atlas/scenarios/official-1444/ownership.csv",
        "atlas/scenarios/official-1444/ownership.json",
        "atlas/scenarios/official-1444/ownership_choropleth.geojson",
        "atlas/scenarios/official-1444/scenario_manifest.json",
        "atlas/scenarios/official-1444/tags.csv",
        "atlas/scenarios/official-1444/uncertainty.geojson",
        "atlas/scenarios/official-1836/countries.json",
        "atlas/scenarios/official-1836/legend.json",
        "atlas/scenarios/official-1836/owners.geojson",
        "atlas/scenarios/official-1836/ownership.csv",
        "atlas/scenarios/official-1836/ownership.json",
        "atlas/scenarios/official-1836/ownership_choropleth.geojson",
        "atlas/scenarios/official-1836/scenario_manifest.json",
        "atlas/scenarios/official-1836/tags.csv",
        "atlas/scenarios/official-1836/uncertainty.geojson",
        "atlas/tables/provinces.csv",
        "pack/README.md",
        "pack/attribution.json",
        "pack/definitions/adjacency.csv",
        "pack/definitions/provinces.json",
        "pack/definitions/regions.json",
        "pack/definitions/sea_zones.json",
        "pack/geojson/provinces.geojson",
        "pack/geojson/regions.geojson",
        "pack/geojson/sea_zones.geojson",
        "pack/localization/english.json",
        "pack/localization/english.yml",
        "pack/pack_manifest.json",
        "pack/scenarios/modern-baseline/countries.json",
        "pack/scenarios/modern-baseline/ownership.csv",
        "pack/scenarios/modern-baseline/ownership.json",
        "pack/scenarios/modern-baseline/scenario_manifest.json",
        "pack/scenarios/official-1444/countries.json",
        "pack/scenarios/official-1444/ownership.csv",
        "pack/scenarios/official-1444/ownership.json",
        "pack/scenarios/official-1444/scenario_manifest.json",
        "pack/scenarios/official-1836/countries.json",
        "pack/scenarios/official-1836/ownership.csv",
        "pack/scenarios/official-1836/ownership.json",
        "pack/scenarios/official-1836/scenario_manifest.json",
        "pack/tables/population.csv",
        "pack/tables/terrain.csv"
      ],
      "license": "CC BY 4.0",
      "license_posture": "attribution-required",
      "public_path": true,
      "required": true,
      "source_id": "geoboundaries",
      "title": "geoBoundaries",
      "url": "https://www.geoboundaries.org/"
    },
    {
      "attribution_text": "Natural Earth public domain data.",
      "downstream_outputs": [
        "atlas/README.md",
        "atlas/atlas_manifest.json",
        "atlas/attribution.json",
        "atlas/geojson/provinces.geojson",
        "atlas/scenarios/modern-baseline/countries.json",
        "atlas/scenarios/modern-baseline/legend.json",
        "atlas/scenarios/modern-baseline/owners.geojson",
        "atlas/scenarios/modern-baseline/ownership.csv",
        "atlas/scenarios/modern-baseline/ownership.json",
        "atlas/scenarios/modern-baseline/ownership_choropleth.geojson",
        "atlas/scenarios/modern-baseline/scenario_manifest.json",
        "atlas/scenarios/modern-baseline/tags.csv",
        "atlas/scenarios/modern-baseline/uncertainty.geojson",
        "atlas/scenarios/official-1444/countries.json",
        "atlas/scenarios/official-1444/legend.json",
        "atlas/scenarios/official-1444/owners.geojson",
        "atlas/scenarios/official-1444/ownership.csv",
        "atlas/scenarios/official-1444/ownership.json",
        "atlas/scenarios/official-1444/ownership_choropleth.geojson",
        "atlas/scenarios/official-1444/scenario_manifest.json",
        "atlas/scenarios/official-1444/tags.csv",
        "atlas/scenarios/official-1444/uncertainty.geojson",
        "atlas/scenarios/official-1836/countries.json",
        "atlas/scenarios/official-1836/legend.json",
        "atlas/scenarios/official-1836/owners.geojson",
        "atlas/scenarios/official-1836/ownership.csv",
        "atlas/scenarios/official-1836/ownership.json",
        "atlas/scenarios/official-1836/ownership_choropleth.geojson",
        "atlas/scenarios/official-1836/scenario_manifest.json",
        "atlas/scenarios/official-1836/tags.csv",
        "atlas/scenarios/official-1836/uncertainty.geojson",
        "atlas/tables/provinces.csv",
        "pack/README.md",
        "pack/attribution.json",
        "pack/definitions/adjacency.csv",
        "pack/definitions/provinces.json",
        "pack/definitions/regions.json",
        "pack/definitions/sea_zones.json",
        "pack/geojson/provinces.geojson",
        "pack/geojson/regions.geojson",
        "pack/geojson/sea_zones.geojson",
        "pack/localization/english.json",
        "pack/localization/english.yml",
        "pack/pack_manifest.json",
        "pack/scenarios/modern-baseline/countries.json",
        "pack/scenarios/modern-baseline/ownership.csv",
        "pack/scenarios/modern-baseline/ownership.json",
        "pack/scenarios/modern-baseline/scenario_manifest.json",
        "pack/scenarios/official-1444/countries.json",
        "pack/scenarios/official-1444/ownership.csv",
        "pack/scenarios/official-1444/ownership.json",
        "pack/scenarios/official-1444/scenario_manifest.json",
        "pack/scenarios/official-1836/countries.json",
        "pack/scenarios/official-1836/ownership.csv",
        "pack/scenarios/official-1836/ownership.json",
        "pack/scenarios/official-1836/scenario_manifest.json",
        "pack/tables/population.csv",
        "pack/tables/terrain.csv"
      ],
      "license": "Public domain",
      "license_posture": "public-domain",
      "public_path": true,
      "required": true,
      "source_id": "natural_earth",
      "title": "Natural Earth",
      "url": "https://www.naturalearthdata.com/"
    },
    {
      "attribution_text": "gadm: restricted — excluded from public releases (Restricted non-commercial/academic use).",
      "downstream_outputs": [],
      "isolation_notice": true,
      "license": "Restricted non-commercial/academic use",
      "license_posture": "restricted",
      "public_path": false,
      "required": false,
      "source_id": "gadm",
      "title": "GADM (isolated / excluded)",
      "url": "https://gadm.org/"
    },
    {
      "attribution_text": "open_historical_map: isolated/optional path — posture `review-per-feature` (Mostly CC0, with per-feature exceptions). Not mixed into public beta packs.",
      "downstream_outputs": [],
      "isolation_notice": true,
      "license": "Mostly CC0, with per-feature exceptions",
      "license_posture": "review-per-feature",
      "public_path": false,
      "required": false,
      "source_id": "open_historical_map",
      "title": "OpenHistoricalMap (isolated / excluded)",
      "url": "https://www.openhistoricalmap.org/"
    },
    {
      "attribution_text": "openstreetmap: isolated/optional path — posture `share-alike-database` (ODbL). Not mixed into public beta packs.",
      "downstream_outputs": [],
      "isolation_notice": true,
      "license": "ODbL",
      "license_posture": "share-alike-database",
      "public_path": false,
      "required": false,
      "source_id": "openstreetmap",
      "title": "OpenStreetMap (isolated / excluded)",
      "url": "https://www.openstreetmap.org/"
    }
  ],
  "catalog_sources": [
    {
      "attribution_text": "GADM is excluded from default builds unless permission is obtained.",
      "default_path": "excluded",
      "eligible_for_default_build": false,
      "enabled_by_default": false,
      "in_profile_default": false,
      "isolated": true,
      "license": "Restricted non-commercial/academic use",
      "license_posture": "restricted",
      "name": "GADM",
      "optional": false,
      "restricted": true,
      "source_id": "gadm",
      "source_url": "https://gadm.org/"
    },
    {
      "attribution_text": "geoBoundaries data requires CC BY 4.0 attribution.",
      "default_path": "core",
      "eligible_for_default_build": true,
      "enabled_by_default": true,
      "in_profile_default": true,
      "isolated": false,
      "license": "CC BY 4.0",
      "license_posture": "attribution-required",
      "name": "geoBoundaries",
      "optional": false,
      "restricted": false,
      "source_id": "geoboundaries",
      "source_url": "https://www.geoboundaries.org/"
    },
    {
      "attribution_text": "GHSL citation requirements must be recorded before generated data is published.",
      "default_path": "deferred-default",
      "eligible_for_default_build": true,
      "enabled_by_default": false,
      "in_profile_default": false,
      "isolated": false,
      "license": "Open/free Copernicus/JRC data",
      "license_posture": "citation-required",
      "name": "GHSL",
      "optional": false,
      "restricted": false,
      "source_id": "ghsl",
      "source_url": "https://ghsl.jrc.ec.europa.eu/"
    },
    {
      "attribution_text": "Natural Earth public domain data.",
      "default_path": "core",
      "eligible_for_default_build": true,